{
  "$schema": "https://json-schema.org/draft/2020-12/schema",
  "$id": "https://github.com/mnemom/aip/schemas/aap-sharecard.schema.json",
  "title": "AAP-ShareCard/v1",
  "description": "Signed share card. Ed25519 (base64url) over canonical JSON (sorted keys, no whitespace) of the card minus `signature`; `typ` is pinned. Numbers come only from signed statements committed by hash. Identifying fields (repo, branch, PR title, commit message) are not part of the format: additionalProperties is false everywhere.",
  "type": "object",
  "additionalProperties": false,
  "required": ["typ", "card_id", "period", "issued_at", "signing_key_id", "statements", "lines", "signature"],
  "properties": {
    "typ": { "const": "AAP-ShareCard/v1" },
    "card_id": { "type": "string", "minLength": 1 },
    "period": {
      "type": "object",
      "additionalProperties": false,
      "required": ["start", "end"],
      "properties": {
        "start": { "type": "string", "pattern": "^\\d{4}-\\d{2}-\\d{2}$" },
        "end": { "type": "string", "pattern": "^\\d{4}-\\d{2}-\\d{2}$" }
      }
    },
    "issued_at": { "type": "string", "format": "date-time" },
    "signing_key_id": { "type": "string", "minLength": 1 },
    "statements": {
      "type": "array",
      "minItems": 1,
      "items": {
        "type": "object",
        "additionalProperties": false,
        "required": ["typ", "hash"],
        "properties": {
          "typ": { "type": "string", "minLength": 1 },
          "hash": { "type": "string", "pattern": "^[0-9a-f]{64}$" }
        }
      }
    },
    "lines": {
      "type": "array",
      "minItems": 1,
      "items": {
        "type": "object",
        "additionalProperties": false,
        "required": ["id", "kind", "label", "value", "statement_hash"],
        "properties": {
          "id": { "type": "string", "minLength": 1 },
          "kind": { "enum": ["count", "revert"] },
          "label": { "type": "string", "minLength": 1 },
          "value": { "type": "integer", "minimum": 0 },
          "statement_hash": { "type": "string", "pattern": "^[0-9a-f]{64}$", "description": "Must equal a hash listed in `statements`." }
        }
      }
    },
    "signature": { "type": "string", "minLength": 1 }
  }
}
