{
  "typ": "AAP-ShareCard/v1",
  "card_id": "card-valid-0001",
  "period": {
    "start": "2026-10-01",
    "end": "2026-10-07"
  },
  "issued_at": "2026-10-08T00:00:00.000Z",
  "signing_key_id": "test-sharecard-key-1",
  "statements": [
    {
      "typ": "AAP-Statement/v1",
      "hash": "1111111111111111111111111111111111111111111111111111111111111111"
    },
    {
      "typ": "AAP-Statement/v1",
      "hash": "2222222222222222222222222222222222222222222222222222222222222222"
    }
  ],
  "lines": [
    {
      "id": "l1",
      "kind": "count",
      "label": "Changes reviewed",
      "value": 4200,
      "statement_hash": "1111111111111111111111111111111111111111111111111111111111111111"
    },
    {
      "id": "l2",
      "kind": "count",
      "label": "Checks passed",
      "value": 40,
      "statement_hash": "2222222222222222222222222222222222222222222222222222222222222222"
    }
  ],
  "signature": "qsHSChAxBEnEyNoQQLQMFXZ6LKxruMyijxA5s3h9oPKl4OijJqxFm3QC0rteDXJsYwJCMeKyk_0xzGTDc3wDAQ"
}
